{
  "id": "language:phb:druidic",
  "name": "Druidic",
  "sourceMetadata": {
    "source": "PHB",
    "page": 64,
    "flags": {
      "srd": true,
      "basicRules": true
    },
    "reprintedAs": [
      {
        "targetType": "language",
        "id": "language:xphb:druidic"
      }
    ]
  },
  "category": "secret",
  "communicationModes": [
    "SPOKEN",
    "LEFT_MESSAGE"
  ],
  "communicationCapabilities": [
    {
      "kind": "CONCEALED_MESSAGE",
      "channel": "LEFT_MESSAGE",
      "comprehension": {
        "kind": "REQUIRES_LANGUAGE_KNOWLEDGE"
      },
      "recognition": {
        "kind": "AUTOMATIC_IF_LANGUAGE_KNOWN",
        "otherwise": {
          "kind": "CHECK_FOR_PRESENCE",
          "ability": "wisdom",
          "skill": {
            "targetType": "skill",
            "id": "skill:phb:perception"
          },
          "dc": 15,
          "outcome": "DETECT_PRESENCE_ONLY"
        }
      },
      "deciphering": {
        "kind": "MAGIC_REQUIRED_FOR_NON_KNOWERS"
      }
    }
  ]
}
