{
  "id": "language:ggr:abyssal",
  "name": "Abyssal",
  "sourceMetadata": {
    "source": "GGR",
    "page": 9
  },
  "category": "standard",
  "script": "Infernal",
  "typicalSpeakers": [
    {
      "filter": {
        "targetType": "creature",
        "selector": {
          "kind": "TAG",
          "value": "demon",
          "source": "GGR"
        }
      }
    },
    {
      "filter": {
        "targetType": "creature",
        "selector": {
          "kind": "TAG",
          "value": "devil",
          "source": "GGR"
        }
      }
    }
  ]
}
